,index,food_start,food_end,food_text,chemical_start,chemical_end,chemical_text,chemical_id,sentence,supported_by,contains_relation
212,6506,467,471,rice,534,545,amino acids,,"In the diverse land plants Marchantia polymorpha (liverwort) and Oryza sativa (rice), the mitochondrial-encoded L2 ribosomal protein is about 500 amino acids long owing to a centrally located expansion containing the beta3-beta4 strand region.",butter|foodb_non_scientific,0
213,6552,111,120,beverages,0,11,Anthocyanin,,Anthocyanin-rich purple corn pericarp water extract (PCW) has the potential to be used as a natural pigment in beverages.,butter|foodb_non_scientific,0
214,6562,67,73,butter,24,35,polyphenols,,"In Southwest China, tea polyphenols are usually utilized by way of butter tea.",butter|foodb_non_scientific,0
215,6572,727,733,pectin,634,640,sugars,,"Beside simple sugars, other carbohydrates reported in tobacco are oligosaccharides, cellulose, starch, and pectin.",butter|foodb_non_scientific,0
216,6575,570,576,barley,647,656,bile acid,,"Viscous interactions were detected for apple, barley, citrus, lupin, pea, and potato derived ingredients, which slowed the bile acid release rate by up to 80%.",butter|foodb_non_scientific,0
217,6577,9,15,fruits of Phaleria macrocarpa,40,54,icariside C(3),,"From the fruits of Phaleria macrocarpa, icariside C(3) (1), phalerin (2), and mangiferin (3) were isolated and their structures were identified on the basis of spectroscopic data.",butter|foodb_non_scientific,1
218,6580,76,82,Trichilia connaroides,0,16,Trichiconlides A,,"Trichiconlides A (1) and B (2), two novel limonoids, were isolated from the fruits of Trichilia connaroides.",butter|foodb_non_scientific,1
219,6587,137,141,eggs,156,162,folate,,"We recently developed novel eggs enriched with folate through folic acid supplementation of the hen's feed, but their potential to influence consumer folate status is unknown because the natural folate forms incorporated into the eggs may not necessarily be retained during storage and cooking.",butter|foodb_non_scientific,0
220,6595,312,320,seed shells of the Japanese horse chestnut,346,363,proanthocyanidins,,"Recently, we have shown that seed shells of the Japanese horse chestnut contain highly polymeric proanthocyanidins as dominant polyphenolics that can be separated into two fractions according to the difference in the molecular sizes.",butter|foodb_non_scientific,1
221,6601,27,33,fruits,65,79,(poly)phenolic,,"Cardiovascular benefits of fruits are attributed mainly to their (poly)phenolic constituents, especially anthocyanins.",butter|foodb_non_scientific,1
222,6608,60,71,soybean cake,111,122,isoflavones,,"Soybean cake, a byproduct obtained during the processing of soybean oil, has been shown to be a rich source of isoflavones.",butter|foodb_non_scientific,1
223,6677,219,229,red clover,312,328,4-methylcatechol,,Lipids emulsified by a polyphenol oxidase (PPO) rich protein extract of red clover were shown before to be protected against this breakdown after cross-linking with 4-methylcatechol.,butter|foodb_non_scientific,0
224,6682,119,128,beverages,6,15,Ciocalteu,,"Folin-Ciocalteu colorimetric assay (FC) is the most widely used assay to estimate the total phenolic content in foods, beverages, herbs and other plant extracts, but many chemical compounds may act as interfering agents, producing inaccurate estimations of the real concentration of phenolic compounds in the matrix.",butter|foodb_non_scientific,0
225,6689,26,30,"Heat-stabilized, defatted rice bran (HDRB)",75,83,Phenolic compounds,,"Heat-stabilized, defatted rice bran (HDRB) serves as a potential source of phenolic compounds which have numerous purported health benefits.",butter|foodb_non_scientific,1
226,6707,4,11,red cabbage,72,84,anthocyanins,,"Red cabbage is, among different vegetables, one of the major sources of anthocyanins.",butter|foodb_non_scientific,1
227,6717,45,55,cottonseed,0,26,Cyclopropenoid fatty acids,,"Cyclopropenoid fatty acids (CPFAs), found in cottonseed, have been shown to have detrimental health effects to susceptible livestock.",butter|foodb_non_scientific,1
228,6722,123,129,coffee,12,30,xanthines caffeine,,"The natural xanthines caffeine, theobromine, and theophylline are of major commercial importance as flavor constituents in coffee, cocoa, tea, and a number of other beverages.",butter|foodb_non_scientific,1
229,6731,722,727,cream,680,692,Deltamethrin,,"Deltamethrin, discovered in 1974, was the cream of the crop and remains 36 years later as one of the most important synthetic pyrethroid insecticides.",butter|foodb_non_scientific,0
230,6760,204,208,rice,0,15,Forchlorfenuron,,"Forchlorfenuron, N-(2-chloro-4-pyridinyl)-N'-phenylurea, is a plant growth regulator used to increase the size of kiwifruit, apples, table grapes, and peaches and to promote increased yields of potatoes, rice, and wheat.",butter|foodb_non_scientific,0
231,6764,32,36,Chinese hickory nuts,124,138,phenolic acids,,U.S. pecans and Chinese hickory nuts possess a wide array of phenolic constituents with potential health benefits including phenolic acids and proanthocyanidins.,butter|foodb_non_scientific,1
232,6801,126,130,rice,72,76,zinc,,"Biofortification of staple food crops is a promising strategy to combat zinc deficiency, and it is of particular interest for rice and crops that are not consumed as flours and therefore not suitable for postharvest fortification.",butter|foodb_non_scientific,0
233,6809,232,238,barley,260,272,tocotrienols,,"Some cereals, especially oat, rye, and barley, are good sources of tocotrienols.",butter|foodb_non_scientific,1
234,6816,186,195,beverages,89,94,Folin,,"The Folin quantitation method can determine both free and total polyphenol antioxidants in foods and beverages as described, as well as botanical extracts.",butter|foodb_non_scientific,0
235,6818,55,58,oat,101,112,cholesterol,,We have earlier demonstrated that muesli enriched with oat beta-glucan effectively lowered serum LDL cholesterol.,butter|foodb_non_scientific,0
236,6829,217,223,fruits of Sinopodophyllum hexandrum,5,26,prenylated flavonoids,,"Four prenylated flavonoids compounds 1-4, named sinopodophyllines A-D, and a flavonoid glycoside (compound 13), sinopodophylliside A, together with 19 known compounds (compounds 5-12 and 14-24) were isolated from the fruits of Sinopodophyllum hexandrum.",butter|foodb_non_scientific,1
237,6863,38,43,wheat storage proteins,0,8,Gliadins,,Gliadins were the major components of wheat storage proteins and determine the extensibility properties of gluten dough.,butter|foodb_non_scientific,1
238,6885,912,916,rice,826,837,Bisphenol-A,,"Bisphenol-A was not detected in raw beef, chicken, cheese, apple, tomatoes, beans and rice; and chicken eggs.",butter|foodb_non_scientific,0
239,6896,40,48,molasses,109,114,sugar,,"Activated carbon has been prepared from molasses, a natural precursor of vegetable origin resulting from the sugar industry in Morocco.",butter|foodb_non_scientific,0
240,6899,182,186,beer,225,229,VDKs,,"Furthermore, generating sorghum beer with low levels of vicinal diketones (VDKs) is a permanent concern of brewers because of the wort's low amino acid content.",butter|foodb_non_scientific,0
241,6902,60,64,pear,0,22,Stemphylium vesicarium,,"Stemphylium vesicarium is the causal agent of brown spot of pear, an important disease reported in pear-growing areas of Europe.",butter|foodb_non_scientific,0
242,6906,117,123,fruits,0,10,Folic acid,,"Folic acid (pteroylmonoglutamic acid) is used in enriched foods; however, very little folic acid occurs naturally in fruits and vegetables.",butter|foodb_non_scientific,0
243,6914,374,380,fruits,345,354,carnitine,,"A diet rich in meat supplies a lot of carnitine, while vegetables, fruits, and grains furnish relatively little.",butter|foodb_non_scientific,0
244,6928,53,60,cabbage,37,49,sphingolipid,,"Previously, we found an unidentified sphingolipid in cabbage, and determined it as phytoceramide 1-phosphate (PC1P).",butter|foodb_non_scientific,1
245,6974,168,172,salt,80,87,glucose,,"Although dietary fiber, psyllium seed husk (psyllium), is known to reduce blood glucose and lipid levels, the effect of psyllium on blood pressure elevation induced by salt ingestion has not been tested in human and rats.",butter|foodb_non_scientific,0
246,6977,323,329,coffee,459,468,Melatonin,,"Both melatonin and 5-HT were detected in green coffee beans (5.8±0.8μg/g dry weight (DW), 10.5±0.6μg/g DW) and also in roasted beans of C. canephora (8.0±0.9μg/g DW, 7.3±0.5μg/g DW).",butter|foodb_non_scientific,1
247,6979,279,289,sesame oil,159,182,unsaturated fatty acids,,"Sesame is one of the earliest oilseed plants, high oil percentage and high content of unsaturated fatty acids, especially oleic acid and linoleic acid, have led to an increase in the nutritional quality of sesame oil.",butter|foodb_non_scientific,1
248,7000,908,912,rice,884,886,Zn,,"Results showed that greenhouse vegetable fields contained significant accumulations of Zn in CGVPS relative to rice-wheat rotation fields, open vegetable fields, and geochemical background levels, and this was the case for organic matter in OGVPS.",butter|foodb_non_scientific,0
249,7002,474,483,olive oil,445,456,acetic acid,,"Distilled water, 3% acetic acid, 10% ethanol and olive oil are used as stimulants of foodstuffs.",butter|foodb_non_scientific,0
250,7043,164,168,corn,109,119,Fumonisins,,Fumonisins (FBs) are mycotoxins which are prevalent in corn (Zea mays L.) and its based foods.,butter|foodb_non_scientific,1
251,7052,45,51,fruits,0,7,Fisetin,,"Fisetin, a flavone that can be isolated from fruits and vegetables, has anti-tumor and anti-oxidative properties and ameliorates airway hyperresponsiveness in asthmatic mice.",butter|foodb_non_scientific,1
252,7062,26,30,rice,0,7,Cadmium,,Cadmium (Cd) contaminated rice has become a global food security issue.,butter|foodb_non_scientific,0
253,7064,0,4,salt,6,10,NaCl,,Salt (NaCl) is a common physiological stressor of plants.,butter|foodb_non_scientific,0
254,7065,7,12,honey,119,133,"1,2-dicarbonyl",,"Manuka honey from New Zealand is known for its exceptional antibacterial activity, which is due to high amounts of the 1,2-dicarbonyl compound methylglyoxal (MGO).",butter|foodb_non_scientific,1
255,7111,827,833,cheese whey,793,800,lactose,,This could be considered as a possible route for whey surplus because lactose is the major component of cheese whey.,butter|foodb_non_scientific,1
256,7116,37,41,corn,10,19,aflatoxin,,Increased aflatoxin contamination in corn by the fungus Aspergillus flavus is associated with frequent periods of drought and heat stress during the reproductive stages of the plants.,butter|foodb_non_scientific,0
257,7121,0,8,chestnut,26,39,carbohydrates,,"Chestnut fruit abounds in carbohydrates, proteins, unsaturated fatty acids, fiber, polyphenolic compounds, as well as vitamins and micronutrients, that are behind the health-promoting properties of this plant.",butter|foodb_non_scientific,1
258,7152,55,66,avocado oil,132,159,monounsaturated fatty acids,,"Four out of eight 'healthier' oils-namely, almond oil, avocado oil, hazelnut oil and macadamia",butter|foodb_non_scientific,1
259,7186,0,11,lingonberry,86,98,anthocyanins,,"Lingonberry grown in northern Manitoba, Canada, contains exceptionally high levels of anthocyanins and other polyphenols.",butter|foodb_non_scientific,1
260,7197,0,3,tea,56,67,polyphenols,,"Tea contains characteristic volatile organic compounds, polyphenols, caffeine and catechins, and is therefore among the most widely consumed beverages all over the world.",butter|foodb_non_scientific,1
261,7200,6,9,green tea,85,93,caffeine,,"Green tea has been widely consumed for its mild flavors and its health benefits, yet caffeine in green tea has been a limitation for those who want to avoid it.",butter|foodb_non_scientific,1
262,7207,25,34,beverages,14,21,ethanol,,The amount of ethanol in beverages has been quantified by density and infrared spectroscopy methods.,butter|foodb_non_scientific,1
263,7214,663,674,fruit juice,607,619,betaxanthins,,"A total of 9 betalains including 6 betaxanthins and 3 betacyanin were also detected in the fruit juice samples and indicaxanthin, betanin and isobetanin were the major pigments.",butter|foodb_non_scientific,1
264,7233,505,517,household-level sweet potato-based infant food,545,554,vitamin A,,"However, unfortified cereal-legume and cereal-only porridges are low in vitamin A. A household-level sweet potato-based infant food, rich in vitamin A, has been developed to complement vitamin A supplementation initiatives in Sub-Saharan Africa.",butter|foodb_non_scientific,1
265,7249,0,6,Coffee infusion mannans,73,77,Galp,,Coffee infusion mannans are acetylated polysaccharides containing single Galp and Araf residues as side chains of a beta-(1 --> 4)-Manp backbone.,butter|foodb_non_scientific,1
266,7258,95,99,rice,49,57,Selenium,,"Selenium (Se) can mitigate Cd accumulation in rice plants, although it is unclear why it has such effect.",butter|foodb_non_scientific,0
267,7263,48,52,rice grain,14,16,Zn,,Understanding Zn uptake dynamics is critical to rice grain Zn biofortification.,butter|foodb_non_scientific,0
268,7424,0,6,butter,18,54,saturated fat [saturated fatty acids (sfas)],,"Butter is rich in saturated fat [saturated fatty acids (SFAs)] and can increase plasma low density lipoprotein (LDL) cholesterol, which is a major risk factor for cardiovascular disease.",butter|foodb_non_scientific,1
269,7442,64,69,Vitis vinifera red grape cultivars,9,18,flavonols,,The main flavonols found in seven widespread Vitis vinifera red grape cultivars include the 3-glucosides and 3-glucuronides of myricetin and quercetin and the 3-glucosides of kaempferol and isorhamnetin.,butter|foodb_non_scientific,1
270,7471,170,174,rice,187,213,epigallocatechin-3-gallate,,"However, there is relatively little understanding about the interaction between rice protein and epigallocatechin-3-gallate (EGCG).",butter|foodb_non_scientific,0
271,7473,60,63,green tea,0,24,Epigallocatechin gallate,,"Epigallocatechin gallate (EGCG), the main catechin of green tea, is described to have potential health benefits in several fields like oncology, neurology or cardiology.",butter|foodb_non_scientific,1
272,7482,0,13,red raspberry,54,65,polyphenols,,Red raspberry (Rubus idaeus L.) contains a variety of polyphenols including anthocyanins and ellagitannins.,butter|foodb_non_scientific,1
273,7544,135,139,salt,0,6,Iodine,,Iodine deficiency disorders (IDD) in sub-Saharan African countries are related to low dietary I intake and generally combatted through salt iodisation.,butter|foodb_non_scientific,0
274,7604,32,41,olive leaves,93,101,phenolic compounds,,Olive leaves are a waste of the olive oil processing industry and represent a good source of phenolic compounds.,butter|foodb_non_scientific,1
275,7639,6,12,fried potato products,88,98,acrylamide,,Fried potato products such as French fries and chips may contain substantial amounts of acrylamide.,butter|foodb_non_scientific,1
276,7679,0,6,coffee,69,77,caffeine,,"Coffee is a stimulant, psychoactive, popular daily beverage, and its caffeine affects human physiological health and behavior.",butter|foodb_non_scientific,1
277,7695,242,251,black tea,267,277,polyphenol antioxidants,,However black tea is a source of polyphenol antioxidants that may enhance cellular antioxidant abilities.,butter|foodb_non_scientific,1
278,7698,242,247,grape seeds,208,219,Polyphenols,,"Polyphenols present in green tea, grape seeds, orange, and grapefruit combat adipogenesis at the molecular level and also induce lipolysis.",butter|foodb_non_scientific,1
279,7843,541,548,gelatin,641,650,glutamine,,"Except for gelatin and feather meal, animal and plant ingredients contained high percentages of glutamate plus glutamine, branched-chain AA, and aspartate plus asparagine, which were 10-32, 15-25, and 8-14% of total protein, respectively.",butter|foodb_non_scientific,1
280,7946,602,611,cereal-based beverages,682,693,polyphenols,,"Cereal-based beverages contain a complex mixture of various polymers that includes proteins, polyphenols, and polysaccharides.",butter|foodb_non_scientific,1
281,7951,963,969,citrus,935,943,naringin,,"In addition, we reported that naringin, a bioflavonoid in citrus fruits, could exert beneficial effects, such as antiautophagic stress and antineuroinflammation, in the KA mouse model of epilepsy, even though it was unclear whether naringin might also attenuate the seizure-induced morphological changes of GCD in the DG.",butter|foodb_non_scientific,1
282,7963,34,43,swordfish,18,25,mercury,,Concentrations of mercury (Hg) in swordfish (Xiphias gladius) present a food safety problem for many countries.,butter|foodb_non_scientific,0
283,7973,100,106,coffee,75,87,caffeic acid,,"Previously, we found that caffeic acid, present in coffee, fruits, and vegetables, strongly inhibited human homologs of organic anion transporters (OATs) OAT1 and OAT3, which are responsible for renal tubular secretion of anionic drugs.",butter|foodb_non_scientific,1
284,7992,149,160,horseradish,125,136,Cholesterol,,"Cholesterol oxidase and horseradish peroxidase, together with potassium ferrocyanide as a mediator, are incorporated into a graphite-70% Teflon matrix.",butter|foodb_non_scientific,0
285,8013,127,136,chocolate,0,10,Flavonoids,,"Flavonoids, a subclass of polyphenols, are major constituents of many plant-based foods and beverages, including tea, wine and chocolate.",butter|foodb_non_scientific,1
286,8195,68,72,eggs of Carassius auratus (Ca-SGP)eggs of Carassius auratus (Ca-SGP),95,97,sialoglycoprotein,,The anti-osteoporotic effect of sialoglycoprotein isolated from the eggs of Carassius auratus (Ca-SGP) has previously been demonstrated in vivo.,butter|foodb_non_scientific,1
287,8220,43,55,bitter gourd (Momordica charantia) seeds ,105,119,Ribonuclease MC1 (RNase MC1) ,,Ribonuclease MC1 (RNase MC1) isolated from bitter gourd (Momordica charantia) seeds specifically cleaves phosphodiester bonds on the 5'-side of uridine.,butter|foodb_non_scientific,1
288,8384,222,237,capsicum annuum,166,173,CaThi thionin-like action mechanism,,"Here we describe some aspects of the CaThi thionin-like action mechanism, previously isolated from Capsicum annuum fruits.",foodb_scientific,1
289,8511,132,145,ginkgo biloba,43,55,Ginkgoside C,,"Two undescribed phenylethanoid glycosides, Ginkgoside C (1) and D (2), together with ten known glycosides (3-12) were isolated from Ginkgo biloba leaves.",foodb_scientific,1
290,8562,299,314,thymus vulgaris,405,421,methyl linoleate,CIDs05284421;CIDs54026370,"Antioxidant activity of these compounds along with 4 flavonoids isolated from thyme (Thymus vulgaris L.) was evaluated by the oil stability index method using a model substrate oil including methyl linoleate in silicone oil at 90 degrees C. Carnosol, rosmanol, epirosmanol, isorosmanol, galdosol, and carnosic acid exhibited remarkably strong activity, which was comparable to that of alpha-tocopherol.",foodb_scientific,0
291,8649,86,104,foeniculum vulgare,4,24,diglucoside stilbene trimers,,Two diglucoside stilbene trimers and a benzoisofuranone derivative were isolated from Foeniculum vulgare fruit together with nine known compounds.,foodb_scientific,1
292,8741,134,152,myristica fragrans,10,38,dihydrobenzofuran neolignans,,"Three new dihydrobenzofuran neolignans, myticaganal A-C (1-3), along with five known compounds (4-8), were isolated from the seeds of Myristica fragrans.",foodb_scientific,1
293,8786,142,147,malus hupehensis,6,21,huperolides A-C (1-3),,"Three dihydrochalcone-derived polyphenols, huperolides A-C (1-3), along with thirteen known compounds (4-16) were isolated from the leaves of Malus hupehensis, the well-known tea crab apple in China.",foodb_scientific,1
294,8854,148,166,phaseolus vulgaris,37,38,A 7.3-kDa antifungal peptide with an N-terminal sequence,,A 7.3-kDa antifungal peptide with an N-terminal sequence exhibiting remarkable homology to defensins from other leguminous plants was isolated from Phaseolus vulgaris cv. ',foodb_scientific,1
295,8875,274,287,curcuma longa,247,259,curcuminoids,,"However, whether two other curcuminoids isolated from Curcuma longa, demethoxycurcumin (DMC) and bisdemethoxycurcumin (BDMC), also demonstrate antimigratory activity in VSMCs similar to that of curcumin remain uncharacterized.",foodb_scientific,1
296,9105,303,321,physalis peruviana,4,60,3-O-beta-D-glucopyranosyl-(1-->6)-beta-D-glucopyranoside,,"The 3-O-beta-D-glucopyranosyl-(1-->6)-beta-D-glucopyranoside of ethyl 3-hydroxyoctanoate and the diastereomeric 3-O-alpha-L-arabinopyranosyl-(1-->6)-beta-D-glucopyranosides of (3R) and (3S)-butyl 3-hydroxybutanoate, respectively, were isolated by chromatographic methods from fruits of cape gooseberry (Physalis peruviana) harvested in Colombia.",foodb_scientific,1
297,9173,133,150,allium fistulosum,6,42,unsaturated fatty acid monoglyceride,,"A new unsaturated fatty acid monoglyceride (1), glycerol mono-(E)-8,11,12-trihydroxy-9-octadecenoate, was isolated from the seeds of Allium fistulosum L. along with five known compounds: tianshic acid (2), 4-(2-formyl-5-hydroxymethylpyrrol-1-yl) butyric acid (3), p-hydroxybenzoic acid (4), vanillic acid (5), and daucosterol (6).",foodb_scientific,1
298,9180,78,89,carum carvi,138,147,glucoside,,"From the water-soluble portion of the methanolic extract of caraway (fruit of Carum carvi L.), an aromatic compound, an aromatic compound glucoside and a glucide were isolated together with 16 known compounds.",foodb_scientific,1
299,9294,85,101,prunus domestica,21,26,3-CQA,,"Neochlorogenic acid (3-CQA) and cryptochlorogenic acid (4-CQA), isolated from prune (Prunus domestica L.), were identified by NMR and MS analyses.",foodb_scientific,1
300,9355,93,112,garcinia mangostana,5,13,xanthone,,Five xanthone derivatives and one flavanol were isolated from the dichloromethane extract of Garcinia mangostana.,foodb_scientific,1
301,9406,465,485,carthamus tinctorius,17,27,flavonoids,,"A total of eight flavonoids (1-8), including a novel quercetin-7-O-(6''-O-acetyl)-beta-D-glucopyranoside (6) and seven known flavonoids, luteolin (1), quercetin (2), luteolin 7-O-beta-D-glucopyranoside (3), luteolin-7-O-(6''-O-acetyl)-beta-D-glucopyranoside (4) quercetin 7-O-beta-D-glucopyranoside (5), acacetin 7-O-beta-D-glucuronide (7) and apigenin-6-C-beta-D-glucopyrano syl-8-C-beta-D-glucopyranoside (8), have been isolated from the leaves of the safflower (Carthamus tinctorius L.) and identified on the basis of spectroscopic and chemical studies.",foodb_scientific,1
302,9445,913,925,ficus carica,967,983,chlorogenic acid,,"Whereas both Ficus carica (fig) and Prunus dulcis (almond) contain chlorogenic acid, furanocoumarins occur only in figs.",foodb_scientific,1
303,9464,641,649,zea mays,794,805,gallic acid,,Purple corn (Zea mays L.) (cereal) exhibited high free radical scavenging-linked antioxidant activity (77%) and had the highest total phenolic content (8 +/-,foodb_scientific,1
304,9471,35,43,zea mays,9,24,hydroxamic acid,,"The main hydroxamic acid in maize (Zea mays L.) is 2-4-dihydroxy-7-methoxy-1,4-benzoxazin-3-one (DIMBOA).",foodb_scientific,1
305,9474,306,325,hibiscus sabdariffa,384,394,flavonoids,,Hibiscus sabdariffa (HS) has been used for various purposes due to myriads of flavonoids present in it.,foodb_scientific,1
306,9477,163,183,vaccinium corymbosum,196,207,polyphenols,,Blueberries (BB; Vaccinium corymbosum L.) contain polyphenols and other active components and have high antioxidant capacities.,foodb_scientific,1
307,9493,476,494,phaseolus vulgaris,266,272,biotin,,"The avidin-biotin-peroxidase technique was used to localize the binding of the following biotinylated lectins: Concanavalin A (Con A), Dolicho biflorus agglutinin (DBA), soybean agglutinin (SBA), peanut agglutinin (PNA), Phaseolus vulgaris agglutinin (PHA), Ricinus communis agglutinin (RCA), wheat germ agglutinin (WGA), and Ulex europaeus agglutinin (UEA).",foodb_scientific,0
308,9501,73,90,camellia sinensis,20,21,O-methyltransferase,,The gene of a novel O-methyltransferase was isolated from tea cultivars (Camellia sinensis L.).,foodb_scientific,1
309,9512,15,34,carya illinoinensis,77,88,polyphenols,,The pecan nut [Carya illinoinensis (Wangenh) C. Koch] is a natural source of polyphenols with antioxidant properties.,foodb_scientific,1
310,9537,73,88,syzygium cumini,0,8,Catechin,,"Catechin is found in several natural sources, as Eugenia dysenterica and Syzygium cumini extracts.",foodb_scientific,1
311,9545,299,310,glycine max,345,358,isoflavonoids,,Soybean (Glycine max) is currently the major source of isoflavonoids in human diet.,foodb_scientific,1
312,9572,59,75,raphanus sativus,122,158,4-methylthio-3-butenyl glucosinolate,,"Myrosinase is a cytosolic plant enzyme present in daikon ( Raphanus sativus, Japanese white radish) roots that hydrolyzes 4-methylthio-3-butenyl glucosinolate (MTBGLS) into the natural pungent agent 4-methylthio-3-butenyl isothiocyanate (MTBITC), which possesses antimicrobial, antimutagenic, and anticarcinogenic properties.",foodb_scientific,0
313,9593,317,331,lactuca sativa,262,272,Graveoline,,Graveoline and 8-MOP substantially inhibited growth of Lactuca sativa (lettuce) seedlings and reduced chlorophyll content at 100 microM; this effect was not due to a direct effect on chlorophyll synthesis.,foodb_scientific,0
314,9682,0,17,agaricus bisporus,47,58,cholesterol,,Agaricus bisporus mushrooms were able to lower cholesterol levels in hypercholesterolaemic rats and it was suggested that dietary fibre might inhibit cholesterol absorption.,foodb_scientific,0
315,9691,38,57,linum usitatissimum,156,172,tetrasaccharides,,Water extraction of semi-retted flax (Linum usitatissimum L.) fiber bundles yielded a mixture of pectic oligosaccharides and two acidic rhamnogalacturonide tetrasaccharides that were separated by size-exclusion chromatography.,foodb_scientific,0
