,index,food_start,food_end,food_text,chemical_start,chemical_end,chemical_text,chemical_id,sentence,supported_by,contains_relation
105,3690,304,310,jujube honey,229,241,Ferulic acid,,"Ferulic acid was the most abundant phenolic acid detected in longan honey, jujube honey and buckwheat honey.",butter|foodb_non_scientific,1
106,3692,40,50,red clover,0,10,Polyphenol,,"Polyphenol oxidase (PPO) in conditioned red clover (ensiled or cut and crushed) reduces both proteolysis and lipolysis in the herbage, which has led to increases in N use efficiency and polyunsaturated fatty acid (PUFA) content of milk when offered to dairy cows.",butter|foodb_non_scientific,1
107,3724,22,28,garlic,0,10,Levamisole,,Levamisole (LEVA) and garlic are prevalent immunomodulators in humans and animals.,butter|foodb_non_scientific,0
108,3726,735,739,corn,791,800,Iprodione,,"Corn and faba beans showed the highest concentration of Iprodione with an average of 6.7 and 5.4 mg/Kg, respectively.",butter|foodb_non_scientific,1
109,3783,101,106,flour,123,128,sugar,,"The main ingredients are flour, water, fat and sugar for puff pastry, and the same plus yeast for fermented pastry.",butter|foodb_non_scientific,0
110,3861,125,134,chocolate,147,157,flavonoids,,Cocoa and particularly dark chocolate are rich in flavonoids and recent studies have demonstrated blood pressure lowering effects of dark chocolate.,butter|foodb_non_scientific,1
111,3867,40,49,mushrooms,92,104,1-octen-3-ol,,The most abundant volatile occurring in mushrooms and responsible for the mushroom odour is 1-octen-3-ol.,butter|foodb_non_scientific,1
112,3902,65,69,baby corn,164,172,phenolic antioxidants,,"QPM (quality protein maize), Baby corn, Popcorn and Sweet corn, which are usually consumed in whole forms can be good supplements of phenolic antioxidants.",butter|foodb_non_scientific,1
113,3904,57,61,rice bran oil (rbo),0,12,Phytosterols,,Phytosterols are important beneficial compounds found in rice bran (RB) and rice bran oil (RBO).,butter|foodb_non_scientific,1
114,3907,191,199,broccoli,349,360,cholesterol,,"We hypothesized that supplementation with dietary antioxidants, such as found in broccoli and its fermented products, might suppress increases in serum lipid peroxidation, contributing to the inhibition of osteoclastic activity after high-cholesterol diet intake.",butter|foodb_non_scientific,0
115,3941,201,204,green tea,147,155,Catechin,,Catechin is a polyphenolic antioxidant found in green tea.,butter|foodb_non_scientific,1
116,3989,110,119,olive oil,57,65,phenolic compounds,,"To date, several in vitro and in vivo studies have shown phenolic compounds occurring naturally in olives and olive oil to be beneficial to human health due to their interaction with intracellular signaling pathways.",butter|foodb_non_scientific,1
117,3990,465,471,coffee,235,245,Acrylamide,,"Acrylamide is a chemical product formed when frying, roasting, grilling or baking carbohydrate-rich foods at temperatures above 120 degrees C. Acrylamide is thus found in a number of foods, such as bread, crisps, French fries and coffee.",butter|foodb_non_scientific,1
118,4017,0,9,black tea,21,29,phenolic antioxidants,,Black tea is rich in phenolic antioxidants and has various health benefits.,butter|foodb_non_scientific,1
119,4071,78,81,green tea leaves,0,10,l-theanine,,l-theanine is a water-soluble non-proteinous amino acid mainly found in green tea leaves.,butter|foodb_non_scientific,1
120,4073,0,6,coffee,39,45,carbon,,Coffee was characterized by proton and carbon nuclear magnetic resonance (NMR) spectroscopy.,butter|foodb_non_scientific,0
121,4075,224,230,coffee,91,99,Caffeine,,"Caffeine, theophylline and theobromine are the most well-known members of this family of compounds; they are present, inter alia, in coffee, tea, cacao, yerba mate and cola drinks.",butter|foodb_non_scientific,1
122,4081,680,684,corn,772,784,carbohydrate,,"Although corn grain responds vigorously and nonlinearly, corn residue shows only modest increases in carbohydrate yields in response to high levels of fertilization (25% increase with 202 kg N ha(-1)).",butter|foodb_non_scientific,0
123,4189,15,21,Solanum nigrum fruits,129,140,amino acids,,"Solanum nigrum fruits have been conventionally used in beverages due to their nutritional substances such as minerals, vitamins, amino acids, proteins, sugars, polyphenols, and anthocyanins.",butter|foodb_non_scientific,1
124,4203,36,46,sesame oil,0,7,Sesamol,,"Sesamol, an antioxidant lignan from sesame oil, possesses neuroprotective bioactivities.",butter|foodb_non_scientific,1
125,4259,0,11,pomegranate,54,67,polyphenolics,,"Pomegranate fruit is an excellent source of bioactive polyphenolics, known to contribute significantly to human health.",butter|foodb_non_scientific,1
126,4269,161,167,fruits of Garcinia cowa,0,25,Tetraoxygenated xanthones,,"Tetraoxygenated xanthones, cowaxanthones A-E, together with 10 previously reported tetraoxygenated xanthones, were isolated from the crude hexane extract of the fruits of Garcinia cowa.",butter|foodb_non_scientific,1
127,4312,561,565,salt,615,623,fentanyl,,"Surprisingly, in addition to the salt-bridge binding mode common to morphinan opiates, fentanyl can move deeper and form a stable hydrogen bond with the conserved His297",butter|foodb_non_scientific,0
128,4314,0,4,rice bran,55,66,tocotrienol,,"Rice bran is abundant in bioactive compounds including tocotrienol (T3, unsaturated vitamin E).",butter|foodb_non_scientific,1
129,4353,84,91,parsley,0,14,Polyacetylenes,,Polyacetylenes of the falcarinol type are present in vegetables such as carrots and parsley.,butter|foodb_non_scientific,1
130,4365,388,392,corn,352,354,Cu,,"The 4 diets contained approximately 20 mg of Cu/kg of dry matter (DM), and had a corn silage-to-grass silage ratio of 0.75:0.25",butter|foodb_non_scientific,0
131,4371,205,217,cocoa powder,162,171,flavanols,,An acute dose of flavanols and oligomeric procyanidins from cocoa powder inhibits platelet activation and function over 6 h in humans.,butter|foodb_non_scientific,1
132,4378,618,626,rosemary,545,547,Cu,,"All herbal infusions were found to release Cu complexing ligands, at concentrations ranging from 8.8 to 112.5 μM in rosemary and marjoram, respectively.",butter|foodb_non_scientific,0
133,4390,154,158,rice,0,13,Flubendiamide,,"Flubendiamide, which belongs to the new chemical class of phthalic acid diamides, is widely used against lepidopteron pests in a variety of vegetable and rice pests.",butter|foodb_non_scientific,0
134,4416,66,70,beer,110,120,fatty acid,,The microbial composition of biofilms from different locations of beer bottling plants were compared based on fatty acid profiles and correlated with the product-spoiling potential of these biofilms.,butter|foodb_non_scientific,0
135,4421,286,292,fruits of R. nutkana,364,375,methicillin,,The methanolic extract of the fruits of R. nutkana was previously found to have inhibitory activity against methicillin-resistant Staphylococcus aureus (MRSA).,butter|foodb_non_scientific,0
136,4451,408,418,sour cream,375,379,NaCl,,"NaCl, barbecue (BBQ), ranch, and sour cream & onion (SC&O) seasoning showed greatest adhesion with water, cheese powder with an emulsion of 12.5% to 25% oil, and cocoa powder with oil.",butter|foodb_non_scientific,0
137,4456,0,3,tea,4,15,polyphenols,,Tea polyphenols have strong antioxidant and antitumor activities.,butter|foodb_non_scientific,1
138,4463,70,73,green tea,0,26,Epigallocatechin-3-gallate,,"Epigallocatechin-3-gallate (EGCG), a major active polyphenol of green tea, has been shown to downregulate inflammatory responses in macrophages; however, the underlying mechanism has not been understood.",butter|foodb_non_scientific,1
139,4466,48,54,coffee,0,10,Troxerutin,,"Troxerutin (TRX) is a flavonoid present in tea, coffee, cereal grains, various fruits and vegetables have been reported to exhibit radioprotective, antithrombotic, nephro and hepato-protective effects.",butter|foodb_non_scientific,1
140,4532,323,332,green tea,221,232,Polyphenols,,"Polyphenols are a family of chemicals found in food and beverages derived from plants, such as cocoa, green tea, turmeric, and soya, as well as in medicinal herbs.",butter|foodb_non_scientific,1
141,4538,129,135,fruits,177,188,long chain fatty acids,,"The fruits provide an oily pulp, rich in long chain fatty acids, and a kernel that encompass more than 50% of lipids rich in medium chain fatty acids (MCFA).",butter|foodb_non_scientific,1
142,4564,56,59,tea leaves,0,11,Amino acids,,Amino acids (AA) are important chemical constituents of tea leaves remarkably influencing the quality of tea.,butter|foodb_non_scientific,1
143,4567,198,204,fruits of macleaya cordata,25,92,"2,3-methylenedioxy-7,10-dimethyl-7,8,9,10-tetrahydro-benzoquinoline",,"Two new alkaloids, named 2,3-methylenedioxy-7,10-dimethyl-7,8,9,10-tetrahydro-benzoquinoline (1) and 2,3-methylenedioxy-7,10-dimethyl-8-carboxyl-benzoquinoline (2), were detected primarily from the fruits of Macleaya cordata by their different fragmentation pathways.",butter|foodb_non_scientific,1
144,4575,10,14,crab,84,96,tetrodotoxin,,The shore crab Hemigrapsus sanguineus hemolymph contains soluble proteins that bind tetrodotoxin (TTX) and are responsible for high resistance of the crab to TTX.,butter|foodb_non_scientific,0
145,4604,287,296,olive oil,236,261,polyphenol hydroxytyrosol,,"The polyphenol hydroxytyrosol (HT) which is present in olive oil and red wine, is regarded to be partly responsible for the beneficial effects associated with olive oil consumption and has shown antiatherogenic activity in vitro and in vivo.",butter|foodb_non_scientific,1
146,4610,903,911,broccoli,977,988,glutathione,,Promising are the preliminary results of human intervention studies demonstrating that the regular intake of broccoli for a relatively short period of time could significantly affect glutathione-S-transferase (GST) activity and cell protection against DNA damage.,butter|foodb_non_scientific,0
147,4615,10,19,chocolate,93,103,flavonoids,,Cocoa and chocolate have recently been found to be rich plant-derived sources of antioxidant flavonoids with beneficial cardiovascular properties.,butter|foodb_non_scientific,1
148,4616,107,111,salt,241,256,calcium lactate,,"Salt tolerance of the starter culture and the salt-to-moisture ratio (S:M) in cheese dictate the final pH of cheese, which influences calcium lactate crystal (CLC) formation.",butter|foodb_non_scientific,0
149,4617,977,985,red wine,867,877,vitamin C.,,Both lipid peroxidation and cooxidation of vitamin E and beta-carotene were inhibited at pH 3.0 by red wine polyphenols.,butter|foodb_non_scientific,0
150,4622,51,54,tea plants (Camellia sinensis L.),11,19,Endogenous nicotine,,Endogenous nicotine was confirmed to be present in tea plants (Camellia sinensis L.) by liquid chromatography-tandem mass spectrometry of tea samples from tea-producing regions in six Asian countries.,butter|foodb_non_scientific,1
151,4650,0,7,vanilla,75,88,glucovanillin,,"Vanilla beans were analyzed using biochemical methods, which revealed that glucovanillin disperses from the inner part to the outer part of the vanilla bean during the curing process and is simultaneously hydrolyzed by β-d-glucosidase.",butter|foodb_non_scientific,0
152,4685,175,179,whey,299,310,amino acids,,"In this revolution, whey is increasingly being viewed as more than a source of proteins with a particularly nutritious composition of essential amino acids.",butter|foodb_non_scientific,1
153,4768,467,474,mustard,417,426,aluminium,,"The richest natural sources of aluminium are tea leaves, Chinese prickly ash and mustard.",butter|foodb_non_scientific,1
154,4788,50,55,flour,10,14,iron,,Elemental iron powders are widely used to fortify flour and other cereal products.,butter|foodb_non_scientific,0
155,5527,495,499,rice,353,370,Retinyl palmitate,,"Retinyl palmitate has been used successfully for decades as a supplement as well as a way to fortify numerous foods, including vegetable oil, rice, monosodium glutamate, cereal flours and sugar.",butter|foodb_non_scientific,0
156,5671,6,11,flour,59,68,vitamin A,,Wheat flour is increasingly being fortified worldwide with vitamin A and iron.,butter|foodb_non_scientific,0
157,5684,10,20,strawberry,66,93,polyunsaturated fatty acids,,"Rapeseed, strawberry and raspberry seed oils are a rich source of polyunsaturated fatty acids and antioxidants such as tocols, bioflavonoids and phytosterols.",butter|foodb_non_scientific,1
158,5695,179,185,coffee oil,109,125,Triacylglycerols,,"Triacylglycerols were found to be the major lipid constituents of the coffee oil along with sterol esters, sterols/triterpene alcohol, hydrocarbons and the hydrolyzed products of triacylglycerols as the minor components.",butter|foodb_non_scientific,1
159,5701,33,37,rice,12,19,arsenic,,Exposure to arsenic (As) through rice consumption potentially threatens millions of people worldwide.,butter|foodb_non_scientific,0
160,5707,1084,1090,H. sosnowksyi fruits,1002,1009,octanal,,The results suggest that octanal may be the main contributor to the allelopathic activity of H. sosnowksyi fruits.,butter|foodb_non_scientific,0
161,5725,0,5,honey,92,97,sugar,,"Honey is a natural sweetener, with an osmotic effect on microorganisms due to the increased sugar content and low amount of water.",butter|foodb_non_scientific,1
162,5731,37,41,whey,68,73,sugar,,Process-stable complexes composed of whey protein isolate (WPI) and sugar beet pectin have great potential as structuring agents or fat replacers in foods.,butter|foodb_non_scientific,0
163,5736,154,159, grape seeds (Vitis vinifera),124,133,Monomeric and oligomeric flavanols (MOF),,Monomeric and oligomeric flavanols (MOF) isolated from grape seeds (Vitis vinifera) have been linked to improved endothelial function and vascular health.,butter|foodb_non_scientific,1
164,5747,2,14,cocoa butter,102,112,fatty acid,,"A cocoa butter equivalent (CBE) was synthesized enzymatically from readily available edible fats with fatty acid and triacylglycerol compositions that closely resemble the fat present in chocolate, cocoa butter.",butter|foodb_non_scientific,0
165,5761,363,370,spinach,318,321,Ecd,,The molting hormone 20-beta-hydroxyecdysone (Ecd) is produced by several plants including spinach and has no estrogenic or androgenic properties but enhances GABAergic effects in neurons.,butter|foodb_non_scientific,0
166,5790,335,339,salt,287,290,PEG,,"However, PEG is almost always used in combination with a salt at either low or relatively high concentrations.",butter|foodb_non_scientific,0
167,5792,33,44,fruit juice,114,119,sugar,,"Despite a common perception that fruit juice is healthy, fruit juice contains high amounts of naturally occurring sugar without the fibre content of the whole fruit.",butter|foodb_non_scientific,1
168,5834,657,664,spinach,775,782,oxalate,,"Only eight foods--spinach, rhubarb, beets, nuts, chocolate, tea, wheat bran, and strawberries--caused a significant increase in urinary oxalate excretion.",butter|foodb_non_scientific,0
169,5847,396,407,coconut oil,386,388,OO,,"SMOFlipid also contains OO (25%), coconut oil (30%), and soybean oil (30%).",butter|foodb_non_scientific,0
170,5870,675,678,tea,703,709,sterol,,"Sunflower and tea-seed oil showed similar sterol compositions, while the tea-seed oil tocopherol was very similar to palm oil.",butter|foodb_non_scientific,0
171,5878,81,86,grape,57,64,tannins,,"Binding parameters for the interactions of four types of tannins: tea catechins, grape seed proanthocyanidins, mimosa 5-deoxy proanthocyanidins, and sorghum procyanidins (mDP=17), with gelatin and bovine serum albumin (BSA) have been determined from isothermal titration calorimetry data.",butter|foodb_non_scientific,0
172,5910,458,464,potato,397,413,saposins A and C,,"Similar to other members of the saposin-like protein family, most notably saposins A and C, the recently resolved crystal structure of potato (Solanum tuberosum) plant-specific insert has been shown to exist in a substrate-bound open conformation in which the plant-specific insert oligomerizes to form homodimers.",butter|foodb_non_scientific,0
173,5914,630,634,rice,659,674,hydroxyl-propyl,,"These polysaccharide-based films consist of different natural starches (potato, cassava, wheat, pea and rice) and synthetic polymers hydroxyl-propyl cellulose (HPC) and carboxyl methyl cellulose (CMC)).",butter|foodb_non_scientific,0
174,5922,239,243,rice,231,235,F3'H,,One F3'H in rice was found to display novel chrysoeriol-specific 5'-hydroxylase activity.,butter|foodb_non_scientific,1
175,5976,835,841,carrot,961,962,Le(a)-carrying N-glycans,,"Apple, asparagus, avocado, banana, carrot, celery, hazelnut, kiwi, onion, orange, pear, pignoli, strawberry, and walnut were particularly rich in Le(a)-carrying N-glycans.",butter|foodb_non_scientific,1
176,5987,0,6,coffee,94,110,chlorogenic acid,,"Coffee and willow are known as valuable sources of biologically active phytochemicals such as chlorogenic acid, caffeine, and salicin.",butter|foodb_non_scientific,1
177,5991,103,122,rabbiteye blueberry,55,66,vaccihein A,,"A new ortho-benzoyloxyphenyl acetic acid ester, called vaccihein A (1), was isolated from the fruit of rabbiteye blueberry (Vaccinium ashei).",butter|foodb_non_scientific,1
178,5994,65,69,rice,15,22,mercury,,"High levels of mercury (Hg), especially methylmercury (MeHg), in rice is of concern due to its potential of entering food chain and the high toxicity to human.",butter|foodb_non_scientific,0
179,6001,23,26,tea leaves,0,19,Flavonol glycosides,,"Flavonol glycosides in tea leaves have been quantified as aglycones, quercetin, myricetin, and kaempferol.",butter|foodb_non_scientific,1
180,6005,9,15,fruits of Celastrus orbiculatus,57,123,"3-oxo-4-benzyl-3, 4-dihydro-1H-pyrrolo [2, 1-c] oxazine-6-methylal",,"From the fruits of Celastrus orbiculatus, a new alkaloid 3-oxo-4-benzyl-3, 4-dihydro-1H-pyrrolo [2, 1-c] oxazine-6-methylal (1), was isolated.",butter|foodb_non_scientific,1
181,6013,348,351,tea,281,285,PROP,,This study tested the hypothesis that PROP-sensitive women would be more likely to reject Japanese green tea and selected soy products.,butter|foodb_non_scientific,0
182,6029,15,18,Context Yellow tea,39,48,catechins,,Context Yellow tea containing the same catechins as other types of tea but in different proportions has been suggested to possess potent anticancer activities.,butter|foodb_non_scientific,1
183,6030,30,35,apple juice extract (AE),85,93,tyrosine,,"Previously, we showed that an apple juice extract (AE) potently inhibits the protein tyrosine kinase (PTK) activity of the epidermal growth factor receptor (EGFR).",butter|foodb_non_scientific,0
184,6036,103,110,saffron,61,68,crocins,,"Crocetin (CRT) and dimethylcrocetin (DMCRT) are derived from crocins which are found in the stigmas of saffron (Crocus sativus L.), while safranal is the main component of saffron's essential oil.",butter|foodb_non_scientific,1
185,6044,153,161,red wine,112,123,Resveratrol,,Resveratrol is a natural polyphenol from red wine which may be beneficial to the cardiovascular system.,butter|foodb_non_scientific,1
186,6047,71,75,eggs,0,6,Lutein,,"Lutein, a fat-soluble carotenoid present in green leafy vegetables and eggs, has strong antioxidant properties and could therefore be important for respiratory health.",butter|foodb_non_scientific,1
187,6101,0,6,quinoa,196,206,amino acid,,Quinoa (Chenopodium quinoa Willd.) is an andean grain with exceptional nutritional properties that has been progressively introduced in western countries as a protein-rich super food with a broad amino acid spectrum.,butter|foodb_non_scientific,1
188,6109,307,311,salt,281,311,4-carboxyphenyl diazonium salt,,The electrode was first derivatized by electrochemical reduction of in situ generated 4-carboxyphenyl diazonium salt (4-CPDS) in acidic aqueous solution yielded stable 4-carboxyphenyl (4-CP) monolayer.,butter|foodb_non_scientific,0
189,6171,343,346,green tea,351,362,theaflavins,,"In this study, epicatechins in green tea and theaflavins in black tea were found to be able to reduce the concentration of MGO in physiological phosphate buffer conditions.",butter|foodb_non_scientific,0
190,6182,546,554,molasses,651,654,IDA,,"This article reviews molasses, a sugar industry by-product, as a potential raw material to develop nutraceutical products for IDA.",butter|foodb_non_scientific,0
191,6201,62,68,shrimp,70,81,cystatins B,,"In shrimp, cystatins B-like (CSTB-L) has not been characterized and its role in WSSV infection is largely unknown.",butter|foodb_non_scientific,0
192,6206,23,32,olive oil,86,100,hydroxytyrosol,,"The health benefits of olive oil are attributed to their bioactive compounds, such as hydroxytyrosol.",butter|foodb_non_scientific,1
193,6223,83,86,green tea,19,43,epigallocatechin gallate,,"In animal studies, epigallocatechin gallate (EGCG), the dominant catechin in green tea, has been shown to improve cholesterol metabolism.",butter|foodb_non_scientific,1
194,6253,326,331,grape seed,234,245,Polyphenols,,"Polyphenols from coffee, guava tea, whortleberry, olive oil, propolis, chocolate, red wine, grape seed, and cocoa have been reported to show anti-diabetic effects in T2D patients through increasing glucose metabolism, improving vascular function as well as reducing insulin resistance and HbA1c level.",butter|foodb_non_scientific,1
195,6258,214,219,wheat,160,172,provitamin A,,"Carotenoids in food can function as provitamin A in humans, while grains of Chinese elite wheat cultivars generally have low carotenoid contents.",butter|foodb_non_scientific,0
196,6259,1338,1345,vinegar,1323,1332,sour-acid,,"No significant differences existed in sensory attributes, including creaminess, bitterness, saltiness, sour-acid, and vinegar taste among experimental Akawi cheeses at the same storage period.",butter|foodb_non_scientific,0
197,6260,212,218,coffee,124,133,Xanthines,,"Xanthines in various forms (caffeine, theophylline, theobromine, etc) are abode in tea, coffee, cocoa, chocolate etc.",butter|foodb_non_scientific,1
198,6268,0,17,tartary buckwheat,90,103,carbohydrates,,"Tartary buckwheat (Fagopyrum tataricum) contains a range of nutrients including bioactive carbohydrates and proteins, polyphenols, phytosterols, vitamins, carotenoids, and minerals.",butter|foodb_non_scientific,1
199,6275,19,28,soy cream,87,94,lactose,,"Desserts made with soy cream, which are oil-in-water emulsions, are widely consumed by lactose-intolerant individuals in Brazil.",butter|foodb_non_scientific,0
200,6288,120,124,beer,186,192,sulfur,,"Specific applications to wine, beer, brandy, and tequila are described, and the determination of sulfur compounds, phosphate, L-malate, glycerol, fatty acids, phenolic compounds, and urate is included.",butter|foodb_non_scientific,0
201,6303,169,178,green tea,232,241,catechins,,"Green tea which is rich in polyphenolic components such as the catechins, possesses a plenty of pharmacological activities, in particular an antibacterial effect.",butter|foodb_non_scientific,1
202,6318,105,109,mate,85,94,vitamin E,,This research communication addresses the hypothesis that the association of dietary vitamin E and Yerba Mate could help to prevent or decrease oxidation of milk enriched in unsaturated fatty acids (UFA).,butter|foodb_non_scientific,0
203,6324,131,137,ginger,0,18,Tetrahydrocurcumin,,"Tetrahydrocurcumin (THC, 1) and zingerone (2) are biologically active molecules originating from the important spices turmeric and ginger, respectively.",butter|foodb_non_scientific,1
204,6340,604,613,deerberry,285,296,Resveratrol,,"Resveratrol was found in Vaccinium angustifolium (lowbush blueberry), Vaccinium arboretum (sparkleberry), Vaccinium ashei (rabbiteye blueberry), Vaccinium corymbosum (highbush blueberry), Vaccinium elliottii (Elliott's blueberry), Vaccinium macrocarpon (cranberry), Vaccinium myrtillus (bilberry), Vaccinium stamineum (deerberry), Vaccinium vitis-ideae var.",butter|foodb_non_scientific,1
205,6367,319,328,black tea,296,307,theaflavins,,"Several studies have found effective anti-cancer activities of theaflavins, the major black tea polyphenols.",butter|foodb_non_scientific,1
206,6382,0,12,sweet orange,61,71,flavonoids,,"Sweet orange (Citrus sinensis L.) peel is a rich resource of flavonoids, especially polymethoxyflavones (PMFs).",butter|foodb_non_scientific,1
207,6388,0,8,red wine,45,56,polyphenols,,"Red wine contains many potentially bioactive polyphenols including resveratrol, catechins, anthocyanins and flavonoids as well as tannins derived from oak during maturation.",butter|foodb_non_scientific,1
208,6394,157,164,cabbage,37,44,ethanol,,"In this study, we discovered that an ethanol (EtOH) extract of Solanum nigrum inhibited spore germination of Alternaria brassicicola, the causative agent of cabbage black leaf spot disease.",butter|foodb_non_scientific,0
209,6401,275,281,coffee,128,136,Phenolic compounds,,"Phenolic compounds are abundant in foods and beverages (fresh and processed fruits and vegetables, leguminous plants, cereals, herbs, spices, tea, coffee, wine, beer) and their pleiotropic biological activities result in numerous health beneficial effects.",butter|foodb_non_scientific,1
210,6411,13,17,rice,130,142,gastric acid,,"Breakdown of rice during gastric digestion may be influenced by rice structure, presence of salivary α-amylase, and hydrolysis by gastric acid.",butter|foodb_non_scientific,0
211,6480,94,103,olive oil,0,9,Polymerin,,"Polymerin is a humic acid-like polymer, which we previously recovered for the first time from olive oil mill waste waters (OMWW) only, and chemically and physicochemically characterized.",butter|foodb_non_scientific,0
