,index,food_start,food_end,food_text,chemical_start,chemical_end,chemical_text,chemical_id,sentence,supported_by,contains_relation
316,9692,0,10,Cinnamomum osmophloeum (indigenous cinnamon) ,115,132,proanthocyanidins,,Cinnamomum osmophloeum (indigenous cinnamon) is an endemic species in Taiwan and its twigs contain abundant A-type proanthocyanidins.,foodb_scientific,1
317,9693,62,68,allium,0,14,Thiosulfinates,,"Thiosulfinates, a natural antibiotic, existed in all parts of Allium, therefore might be accumulated in large amounts in food waste (FW).",foodb_scientific,1
318,9694,648,663,punica granatum,508,520,punicalagins,,"More than 65 punicalagins, ellagic acid derivatives, flavonoids, anthocyanins, and phenylpropanoids were simultaneously detected from four centuries old Punica granatum L. ecotypes from northern Italy and compared with those of P. granatum cv.",foodb_scientific,1
319,9719,375,388,curcuma longa,425,433,curcumin,,"On the other hand, curcumin is a polyphenol extracted from the rhizome of Curcuma longa L. Previous studies have shown that curcumin protects against the cisplatin-induced AKI; however, it is unknown whether curcumin can reduce alterations in mitochondrial bioenergetics and dynamic in this model.",foodb_scientific,1
320,9723,8,22,musa acuminata,161,177,arabinogalactans,,"Banana (Musa acuminata and M. acuminata x M. balbisiana) fruit cell walls are rich in mannans, homogalacturonans and xylogalacturonan, rhamnogalacturonan-I, and arabinogalactans, certain forms of which is considered to have immunomodulatory activity.",foodb_scientific,1
321,9736,356,374,averrhoa carambola,425,433,Cd (7.57,,"The carambola (Averrhoa carambola) accumulated exceptionally high concentrations of Cd (7.57, 10.84, 9.01 and 2.15 mg/kg dw in root, twig, leaf and fruit, respectively), being 6.0-24 times and 4.0-10 times",foodb_scientific,1
322,9757,577,597,vaccinium corymbosum,407,419,anthocyanins,,"In this review, we briefly yet critically assess the available evidence in support of an anti-diabetic role of anthocyanins derived from berries, especially bilberry (Vaccinium myrtillus L., also known as European blueberry, whortleberry, huckleberry and blaeberry) and blueberry (Vaccinium corymbosum, native to the United States).",foodb_scientific,1
323,9774,15,32,tamarindus indica,155,171,ammonium acetate,,The complex of Tamarindus indica Kunitz-type trypsin inhibitor and porcine trypsin has been crystallized by the sitting-drop vapour-diffusion method using ammonium acetate as precipitant and sodium acetate as buffer.,foodb_scientific,0
324,9778,0,13,lupinus albus,138,145,glucose,,"Lupinus albus seeds contain conglutin gamma (Cγ) protein, which exerts a hypoglycemic effect and positively modifies proteins involved in glucose homeostasis.",foodb_scientific,0
325,9779,34,52,papaver somniferum,83,91,morphine,,Three white poppy seed samples of Papaver somniferum L were found to contain total morphine (free and bound) in the range 58.4 to 62.2 micrograms/g seeds and total codeine (free and bound) in the range 28.4 to 54.1 micrograms/g seeds.,foodb_scientific,1
326,9791,284,299,empetrum nigrum,219,225,Carbon,,Carbon content ranged from 40.3% (Corydalis conorhiza) to 51.7% (Empetrum nigrum) with mean value 43.4%.,foodb_scientific,1
327,9796,12,31,vaccinium myrtillus,79,91,anthocyanins,,"Bilberries (Vaccinium myrtillus L.) and their major polyphenolic constituents, anthocyanins, have preventive activities inter alia against colon cancer and inflammatory bowel diseases.",foodb_scientific,1
328,9797,72,85,curcuma longa,0,8,Curcumin,,Curcumin (Diferuloylmethane) is a major chemical component of turmeric (curcuma longa) and is used as a spice to give a specific flavor and yellow color in Asian food.,foodb_scientific,1
329,9803,90,103,ginkgo biloba,4,14,flavonoids,,The flavonoids and the terpene lactones are regarded as the two main active components of Ginkgo biloba that affect human health.,foodb_scientific,1
330,9812,295,308,curcuma longa,251,259,Curcumin,,"Curcumin, a natural compound extracted from Curcuma Longa L., is known for its anti-oxidant properties.",foodb_scientific,1
331,9817,21,35,sambucus nigra,148,160,anthocyanins,,"European elderberry (Sambucus nigra), recognized in Europe for its health-promoting properties for many generations, is known to contain a range of anthocyanins, flavonoids, and other polyphenolics that contribute to the high antioxidant capacity of its berries.",foodb_scientific,1
332,9822,1581,1596,sorghum bicolor,1621,1630,cisplatin,,"Hence, this protective effect of Sorghum bicolor leaf sheath dye against cisplatin-induced hepatotoxicity in rats reflects its potential and beneficial role in the prevention of liver damage associated with cisplatin administration.",foodb_scientific,0
333,9824,90,103,curcuma longa,0,8,Curcumin,,"Curcumin, bisdemethoxycurcumin and demethoxycurcumin are the main curcuminoids present in Curcuma longa L. and are known for their bioactivity.",foodb_scientific,1
334,9831,146,159,curcuma longa,92,100,Curcumin,,Curcumin is an active principle of the perennial herb curcuma longa (commonly known as turmeric).,foodb_scientific,1
335,9836,80,95,cancer magister,0,11,Domoic acid,,Domoic acid has been found in razor clams (Siliqua patula) and dungeness crabs (Cancer magister) in Washington State and elsewhere on the West Coast of the United States.,foodb_scientific,1
336,9840,147,162,theobroma cacao,9,21,procyanidins,,"The main procyanidins, including dimeric B2 and B5, trimeric C1, tetrameric and pentameric procyanidins, were isolated from unroasted cocoa beans (Theobroma cacao L.) using various techniques of countercurrent chromatography, such as high-speed countercurrent chromatography (HSCCC), low-speed rotary countercurrent chromatography (LSRCCC) and spiral-coil LSRCCC.",foodb_scientific,1
337,9916,49,62,olea europaea,81,95,hydroxytyrosol,,"Phenolic compounds derived from the olive plant (Olea europaea L.), particularly hydroxytyrosol and oleuropein, have many beneficial effects in vitro.",foodb_scientific,1
338,9927,350,370,siraitia grosvenorii,8,30,cucurbitane glycosides,,"Six new cucurbitane glycosides, mogroside II B (2), 11-deoxymogroside III (4), 7-oxomogroside II E (5), 7-oxomogroside V (6), 11-oxomogroside II A1 (7), and 11-oxomogroside IV A (8), and two known but new naturally occurring cucurbitane glycosides, mogroside II A1 (1) and mogroside III A2 (3), were isolated from an ethanol extract of the fruits of Siraitia grosvenorii.",foodb_scientific,1
339,9943,205,221,mangifera indica,117,133,Barium carbonate,,Barium carbonate nanoparticles (BaCO3 NPs) were synthesized using an aqueous extract of Mangifera indica seed as a reducing agent.,foodb_scientific,0
340,9945,7,26,phoenix dactylifera,104,110,sugars,,Dates (Phoenix dactylifera L.) are distributed worldwide as major food complement providing a source of sugars and dietary fiber as well as macro- and micronutrients.,foodb_scientific,1
341,9948,88,93,pinus maritime,13,16,PYC,,Pycnogenol® (PYC) is a standardized extracts from the bark of the French maritime pine (Pinus maritime) and used as a herbal remedy for various diseases.,foodb_scientific,1
342,9959,879,896,citrus reticulata,799,807,Linalool,,"Linalool, used at levels similar to those present in resistant Ponkan mandarin (Citrus reticulata Blanco) leaves, was able to inhibit growth of XCC in vitro.",foodb_scientific,1
343,9962,0,17,tamarindus indica fruit shells (tifss),53,60,calcium,,Tamarindus indica fruit shells (TIFSs) are naturally calcium rich compounds.,foodb_scientific,1
344,9975,121,135,mytilus edulis,19,32,dodecapeptide,,"A novel osteogenic dodecapeptide peptide (PIE), IEELEEELEAER, was purified from the protein hydrolysate of blue mussels (Mytilus edulis).",foodb_scientific,1
345,9980,260,279,hibiscus sabdariffa,204,223,protocatechuic acid,,"Previously, we found that protocatechuic acid (PCA), a polyphenolic compound from Hibiscus sabdariffa L. possessing free radical-scavenging capacity, protected against oxidative damage induced by tert-butylhydroperoxide (t-BHP) in rat primary hepatocytes.",foodb_scientific,1
346,9994,833,851,coriandrum sativum,761,763,Cd,,"However, Cd and Pb in Malva parviflora and Cd in Brassica rapa, and Cr and Ni in Coriandrum sativum exceeded their permissible limits.",foodb_scientific,0
347,10004,313,328,brassica juncea,293,301,Sinapine,,Sinapine content in Brassica juncea germplasm ranges from 6.7 to 15.1 mg/g of dry seed weight (DSW) which is significantly higher than the prescribed permissible level of 3.0 mg/g of DSW.,foodb_scientific,1
348,10005,642,658,nelumbo nucifera,548,556,catechin,,"The catechin level was 0.0025% in the lotus rhizome, and 0.011% in the knot of the lotus rhizome (Nelumbo nucifera cv. '",foodb_scientific,1
349,10012,431,444,curcuma longa,371,379,Curcumin,,"Curcumin is a bioactive substance extracted from rhizome of Curcuma longa L. Its global market is expected to grow in the next few years, especially in the pharmaceutical industry, due to its numerous physiological and pharmacological properties.",foodb_scientific,1
350,10023,584,603,colocasia esculenta,633,662,"2, 3-dimethylmaleic anhydride",,"Using a bioassay driven protocol, we have now isolated a bioactive molecule from the root stock of Colocasia esculenta (L.) and characterized it as 2, 3-dimethylmaleic anhydride (3, 4-dimethyl-2, 5-furandione) based on various physico-chemical and spectroscopic techniques (IR, (1)H NMR, (13)C NMR and Mass).",foodb_scientific,1
351,10040,39,56,pimpinella anisum,0,6,Fennel,,"Fennel, Foeniculum vulgare, and anise, Pimpinella anisum, are plants which have been used as estrogenic agents for millennia.",foodb_scientific,0
352,10045,123,128,rubus,8,14,"ursane-type triterpenoids (1, 2)",,"Two new ursane-type triterpenoids (1, 2) attached to isopropylidenedioxy group were isolated from the seeds of blackberry (Rubus fructicosus L., Rosaceae) along with two known ursane-type triterpenoids, 2,3-O-isopropylidenyl-2α,3α,19α-trihydroxyurs-12-en-28-oic acid (3) and 1β-hydroxyeuscaphic acid (4).",foodb_scientific,1
353,10065,621,640,momordica charantia,598,607,Metformin,,"Promising results are obtained by treatment with Metformin, or possibly Momordica charantia extract, which will correct insulin resistance, with Meldonium improving the transportation of glucose into the mitochondria, with sodium dichloroacetate activating pyruvate dehydrogenase, and with nutraceutical support reducing oxidative and inflammatory impairment.",foodb_scientific,0
354,10072,210,219,spirulina,0,15,Phycocyanobilin,,"Phycocyanobilin is a dark blue linear tetrapyrrole chromophore covalently attached to protein subunits of phycobiliproteins present in the light-harvesting complexes of the cyanobacteria Arthrospira platensis (Spirulina ""superfood"").",foodb_scientific,0
355,10078,1776,1784,zea mays,1753,1762,aluminium,,"Thus, the inoculation of seeds with Burkholderia isolates could prove to be a boon in sequestering aluminium toxicity in Zea mays.",foodb_scientific,0
356,10079,673,694,cantharellus cibarius,779,789,ergosterol,,"In contrast, other species, such as Cantharellus cibarius, Lactarius deliciosus and Craterellus cornucopioides, contained significantly lower ergosterol amounts (0.2-0.4 mg/g).",foodb_scientific,1
357,10080,424,441,agaricus bisporus,497,507,ergosterol,,"Thus, the species Agaricus bisporus and Hygrophorus marzuolus presented high quantities of ergosterol (6.4-6.8 mg/g, dry matter) followed by Pleurotus ostreatus, Calocybe gambosa, Lentinus edodes, and Boletus edulis (3.3-4.0mg/g).",foodb_scientific,1
358,10115,34,48,prunus persica,2,10,methanol,,A methanol extract of the seed of Prunus persica (Rosaceae) was found to inhibit histamine release in human mast cells.,foodb_scientific,1
359,10127,197,213,nelumbo nucifera,11,35,alkyl 4-hydroxybenzoates,,"Four known alkyl 4-hydroxybenzoates, i.e., methyl 4-hydroxybenzoate (1), ethyl 4-hydroxybenzoate (2), propyl 4-hydroxybenzoate (3), and butyl 4-hydroxybenzoate (4), were isolated from the seeds of Nelumbo nucifera Gaertner (Nymphaeaceae) for the first time.",foodb_scientific,1
360,10143,60,73,curcuma longa,27,35,curcumin,,"Supra-nutritional doses of curcumin, derived from the spice Curcuma longa, have been proposed as a potential treatment of inflammation and metabolic disorders related to obesity.",foodb_scientific,1
361,10145,283,300,triticum aestivum,333,343,amino acid,,Six distinct serpins have been identified in grains of hexaploid bread wheat (Triticum aestivum L.) by partial purification and amino acid sequencing.,foodb_scientific,0
362,10147,775,796,levisticum officinale,639,649,phthalides,,"In the first half of the last century, phthalides were isolated from Cnidium officinale and Ligusticum acutilobum, species widely used in Asian traditional medicine, and from Levisticum officinale, a species used as food and condiment.",foodb_scientific,1
363,10156,8,23,citrus sinensis,66,77,polyphenols,,Peel of Citrus sinensis contains significant amounts of bioactive polyphenols that could be used as ingredients for a number of value-added products with health benefits.,foodb_scientific,1
364,10160,45,61,apium graveolens,109,124,linalyl acetate,,"The present study reports the formulation of Apium graveolens essential oil (AGEO) with its major components linalyl acetate (LA) and geranyl acetate (GA) (1:1:1) as a novel green preservative for protection of postharvest food commodities from fungal infestations, aflatoxin B",foodb_scientific,1
365,10163,153,168,capsicum annuum,0,8,Phenolic compounds,,"Phenolic compounds isolated from pepper (Capsicum annum) have been demonstrated to have neuroprotective effects, whereas the physiological properties of Capsicum annuum var.",foodb_scientific,1
366,10194,63,76,brassica rapa,31,38,ethanol,,We previously demonstrated the ethanol extract of the roots of Brassica rapa protects against cisplatin-induced nephrotoxicity by attenuating oxidative stress.,foodb_scientific,1
367,10197,907,917,bos taurus,637,678,Tricine-sodium dodecyl sulfate polyacrylamide gel,,Tricine-sodium dodecyl sulfate polyacrylamide gel electrophoresis and high-performance liquid chromatography coupled to electrospray ionization tandem mass spectrometry confirmed that two peptides components of P5-a corresponded to fractions of 20-78 and 191-277 amino acids in Bos taurus lactoferrin molecule (GI: 221706349).,foodb_scientific,0
368,10229,12,30,trifolium pratense,44,55,isoflavones,,Red clover (Trifolium pratense L.) contains isoflavones that are of interest because of their benefits for human health as well as their adverse effects on the fertility of farm animals.,foodb_scientific,1
369,10233,485,499,mytilus edulis,546,555,carbonate,,"In the case of the blue mussel Mytilus edulis, high body fluid pCO(2) causes low pH and low carbonate concentrations in the extrapallial fluid, which is in direct contact with the inner shell surface.",foodb_scientific,0
370,10246,16,28,ribes nigrum,60,69,phenolics,,"Black currants (Ribes nigrum L.) contain a diverse range of phenolics and possess a high antioxidant activity, which makes them an interesting target for the functional food industry.",foodb_scientific,1
371,10299,18,34,ipomoea aquatica,81,88,phenols,,"The plant species Ipomoea aquatica contains various bioactive constituents, e.g. phenols and flavonoids, which have several medical uses.",foodb_scientific,1
372,10344,16,21,Mulberry fruit (Morus Lhou Koidz.),63,74,anthocyanin,,"Mulberry fruit (Morus Lhou Koidz.), a rich source of the major anthocyanin, cyanidin 3-glucoside (C3G), has traditionally been used for the treatment of inflammatory conditions including rheumatic arthritis.",foodb_scientific,1
373,10350,71,85,equus caballus,128,141,carbohydrates,,Spring and late fall grazing can lead to metabolic problems in horses (Equus caballus L.) as a result of elevated nonstructural carbohydrates (NSC) in pastures.,foodb_scientific,0
374,10354,411,418,vanilla soymilk (SVMH),462,474,nitric oxide,,"Hydrolysates from strawberry-banana soymilk (SBH), mixed berry soymilk (MXH) and vanilla soymilk (SVMH) inhibited the production of nitric oxide (27.9%, 16.4% and 28.6%, respectively), interleukin-1β (26.3%, 39.5% and 21.6%, respectively) and tumour necrosis factor-α (50.2%, 47.5% and 33.3%, respectively).",foodb_scientific,0
375,10380,148,164,moringa oleifera,0,12,Sulforaphane,,"Sulforaphane (SFN) and moringin (GMG-ITC) are edible isothiocyanates present as glucosinolate precursors in cruciferous vegetables and in the plant Moringa oleifera respectively, and recognized for their chemopreventive and medicinal properties.",foodb_scientific,1
376,10397,341,356,annona squamosa,618,626,α-pinene,,"Annona squamosa L., comprised mainly of α-pinene (1.0-11.9%), limonene (0.8-11.7%), β-cubebene (0.5-13.0%), β-caryophyllene (11.6-24.5%), spathulenol (0.8-9.0%), caryophyllene oxide (1.0-10.6%) and α-cadinol (3.3-7.8%).",foodb_scientific,1
377,10418,84,101,brassica oleracea,0,8,Selenium,,Selenium (Se) is a micronutrient in mammalian nutrition and is accumulated in kale (Brassica oleracea L. var.,foodb_scientific,1
378,10420,12,18,Peppermint (Mentha piperita),148,162,salicylic acid,,"Peppermint (Mentha piperita) infusions represent an important source of bioactive compounds with health benefits, which can be enhanced by applying salicylic acid (SA) during plant cultivation.",foodb_scientific,0
379,10443,63,68,Panax ginseng (SPG),29,45,sesquiterpenoids,,"The previous study indicated sesquiterpenoids from the root of Panax ginseng (SPG) exhibited a significant antidepressant-like effect, which might be mediated by the modification of the dopaminergic, GABAergic, and glutamatergic systems.",foodb_scientific,1
380,10444,44,51,opuntia,137,145,betalain,,"Xoconostle, the acidic cactus pear fruit of Opuntia joconostle of the Cactaceae family, is the source of several phytochemicals, such as betalain pigments and numerous phenolic compounds.",foodb_scientific,1
381,10468,45,50,Panax ginseng,0,14,Ginsenoside Re,,"Ginsenoside Re (Re), a compound derived from Panax ginseng, shows an antidiabetic effect.",foodb_scientific,1
382,10498,13,28,punica granatum,99,110,polyphenols,,Pomegranate (Punica granatum L.) juice (PJ) contains different types of antioxidants and bioactive polyphenols and has been reported to promote cardiovascular health through several mechanisms.,foodb_scientific,1
383,10502,91,110,garcinia mangostana,8,17,xanthones,,"Two new xanthones: mangostanaxanthones I (3) and II (5) were isolated from the pericarp of Garcinia mangostana, along with four known xanthones: 9-hydroxycalabaxanthone (1), parvifolixanthone C (2), α-mangostin (4), and rubraxanthone (6).",foodb_scientific,1
384,10512,80,100,petroselinum crispum,12,32,flavonoid glycosides,,Twenty-nine flavonoid glycosides were identified in the aqueous extract (PC) of Petroselinum crispum var.,foodb_scientific,1
385,10532,302,320,phaseolus vulgaris,157,175,N-methylisoleucine,,"N-methylisoleucine, previously reported as a component of naturally occurring peptides, has been isolated as a free amino acid from the seeds of Phaseolus vulgaris (pinto bean), together with S-methylcysteine, pipecolic acid and a dipeptide, gamma-glutamyl-leucine.",foodb_scientific,1
386,10576,573,580,vanilla,591,604,3-ethylphenol,,"Vanillin (vanilla-like) and 3-ethylphenol (smoky, phenolic) showing somewhat lower FD factors (FD = 128) were detected for the first time as constituents of the dried fruit.",foodb_scientific,0
387,10587,1326,1337,glycine max,1400,1403,CO2,,"As an example, at 25°C, Rubisco from Hordeum vulgare and Glycine max presented, respectively, the highest and lowest potential for CO2 assimilation at both high and low chloroplastic CO2 concentrations.",foodb_scientific,0
388,10591,360,368,zea mays,287,300,imidazolinone,,It has been reported that the imidazolinone enantiomers show different inhibiting activities to maize (Zea mays L.) seedlings and ALS.,foodb_scientific,0
389,10604,70,85,vigna angularis,104,120,ammonium sulfate,,"7S globulin (vicilin), the major seed storage protein in adzuki bean [Vigna angularis], was purified by ammonium sulfate fractionation, gel filtration column chromatography, and anion-exchange column chromatography that resulted in two fractions.",foodb_scientific,0
390,10611,113,129,raphanus sativus,0,12,Sulforaphene,,"Sulforaphene, a kind of isothiocyanates, derived from glucoraphenin which is the important ingredient of radish (Raphanus sativus L.) seeds, has shown significant pharmacological activities.",foodb_scientific,0
391,10619,487,503,moringa oleifera,567,574,calcium,,"Cediya (Ficus thonningii), dorowa (Parkia biglobosa) and zogale (Moringa oleifera) were good sources of protein and fat and excellent sources of calcium and iron or copper and zinc.",foodb_scientific,1
392,10645,704,722,katsuwonus pelamis,629,640,amino acids,,"Bullet tuna Mb consisted of 147 amino acids, and the sequence identity was very close to that of skipjack (Katsuwonus pelamis)",foodb_scientific,0
393,10679,0,9,macadamia nuts,34,54,monounsaturated fats,,"Macadamia nuts are rich source of monounsaturated fats (oleic and palmitoleic acids) and contain polyphenol compounds, therefore, their consumption can be expected to impart health benefits to humans.",foodb_scientific,1
394,10692,629,642,linden seed oil,706,717,tocopherols,,"Additionally squalene was detected at 806 and 607 mg/100 g, respectively, for Tilia cordata and T.platyphyllos.",foodb_scientific,1
395,10701,785,800,cyprinus carpio,653,664,microcystin,,"This is the first study reporting microcystin accumulation in the body of the freshwater shrimp Atyaephyra desmsaresti, in the brain of the fish species common carp (Cyprinus carpio) and in the skin of the frog Rana epirotica.",foodb_scientific,0
396,10711,30,45,pouteria sapota,47,74,"β-cryptoxanthin-5,6-epoxide",,"From an extract of red mamey (Pouteria sapota) β-cryptoxanthin-5,6-epoxide, β-cryptoxanthin-5',6'-epoxide, 3'-deoxycapsanthin, and cryptocapsin were isolated and characterized by UV-vis spectroscopy, electronic circular dichroism (ECD), nuclear magnetic resonance (NMR) spectroscopy, and mass spectrometry (MS).",foodb_scientific,1
397,10730,441,454,juglans regia,379,389,methanolic,,"The present study reports the total phenolic contents and antioxidant properties of methanolic and petroleum ether extracts obtained from walnut (Juglans regia L.) seed, green husk and leaf.",foodb_scientific,1
398,10747,385,393,physalis,434,448,linolenic acid,,"Heliothis subflexa reduce their vulnerability to natural enemies through adaptation to a remarkable and previously unknown feature of their host plant, Physalis angulata:",foodb_scientific,0
399,10748,193,210,triticum aestivum,0,16,Secaloindoline a,,Secaloindoline a (Sina) and secaloindoline b (Sinb) genes of hexaploid triticale (x Triticosecale Wittmack) are orthologs of puroindoline a (Pina) and puroindoline b (Pinb) in hexaploid wheat (Triticum aestivum L.).,foodb_scientific,0
400,10770,301,314,pisum sativum,420,427,sucrose,,"Decapitation of garden pea (Pisum sativum) plants has been proposed to release the dormancy of axillary buds lower down the stem due to changes in sucrose supply, and we hypothesized that this response is mediated by Tre6P. Decapitation led to a rapid and sustained rise in Tre6P levels in axillary buds, coinciding with the onset of bud outgrowth.",foodb_scientific,0
401,10782,502,517,capsicum annuum,463,469,Folate,,"Folate in red and green sweet peppers (Capsicum annuum) differed notably (70.2 and 20.7 microg/100 g, respectively) and exceeded existing values determined by microbiological assay (18 and 11 microg/100 g, respectively).",foodb_scientific,1
402,10785,15,26,glycine max,63,74,polyphenols,,"Black soybean (Glycine max L.), a cultivar containing abundant polyphenols in its seed coat such as anthocyanins and flavan-3-ols, has been reported to possess various health benefits toward lifestyle diseases.",foodb_scientific,1
403,10792,12,30,trifolium pratense,43,51,Phenolic compounds,,Red clover (Trifolium pratense) is rich in phenolic compounds.,foodb_scientific,1
404,10796,162,169,vanilla,148,156,Vanillin,,"Vanillin, the vanilla flavoring agent, has been shown to suppress metastasis in a mouse model.",foodb_scientific,1
405,10804,38,54,litchi chinensis,0,10,Polyphenol,,Polyphenol oxidase (PPO) from litchi (Litchi chinensis Sonn.) pericarp was characterized using (,foodb_scientific,1
406,10820,647,656,laminaria,571,580,laminarin,,"The SWE (10 g) contained laminarin (1 g), fucoidan (0.8 g), and ash (8.2 g) and was extracted from a Laminaria spp.",foodb_scientific,1
407,10822,89,107,myristica fragrans,0,19,Dehydrodiisoeugenol,,"Dehydrodiisoeugenol (DDIE), a major active lignan from the seed and aril of the fruit of Myristica fragrans Houtt., functions as a potential anti-inflammatory agent by inhibiting lipopolysaccharide-stimulated nuclear factor kappa B activation and cyclooxygenase-2 expression in macrophages.",foodb_scientific,1
408,10828,157,175,papaver somniferum,15,22,codeine,,"In addition to codeine and morphine, three more compounds: narcotine (noscapine), papaverine, and thebaine were found in Indian and Netherlands poppy seeds (Papaver somniferum L).",foodb_scientific,1
409,10896,145,163,foeniculum vulgare,137,139,CO,,Cassia obtusifolia L. (CO) and Foeniculum vulgare M. (FV) are commonly used as medicinal foods in many countries.,foodb_scientific,0
410,10927,455,460,agave,293,306,D-amino acids,,"D-amino acids were detected in processed saps and juices of trees (maple, palm, birch), fruits (grape, apple, pear, pomegranate, date), and various other plants (agave, beetroot, sugar cane, carob).",foodb_scientific,1
411,10929,64,77,curcuma longa,0,8,Curcumin,,"Curcumin (diferuloylmethane) is the yellow pigment in turmeric (Curcuma longa L.) that is widely used as a spice, food coloring (curry) and preservative.",foodb_scientific,1
